Paper ID,Title,URL,Summary,First Author,Publish Date,Update Date,Code URL,Stars,Categories
2206.13174v1,Towards Unifying Perceptual Reasoning and Logical Reasoning,http://arxiv.org/abs/2206.13174v1,"An increasing number of scientific experiments support the view of perceptionas Bayesian inference, which is rooted in Helmholtz's view of perception asunconscious inference. Recent study of logic presents a view of logicalreasoning as Bayesian inference. In this paper, we give a simple probabilisticmodel that is applicable to both perceptual reasoning and logical reasoning. Weshow that the model unifies the two essential processes common in perceptualand logical systems: on the one hand, the process by which perceptual andlogical knowledge is derived from another knowledge, and on the other hand, theprocess by which such knowledge is derived from data. We fully characterise themodel in terms of logical consequence relations.",Hiroyuki Kido,2022/6/27,2022/6/27,,,['cs.AI']
2206.07711v1,On the Eve of True Explainability for OWL Ontologies: Description Logic Proofs with Evee and Evonne (Extended Version),http://arxiv.org/abs/2206.07711v1,"When working with description logic ontologies, understanding entailmentsderived by a description logic reasoner is not always straightforward. So far,the standard ontology editor Prot\'eg\'e offers two services to help:(black-box) justifications for OWL 2 DL ontologies, and (glass-box) proofs forlightweight OWL EL ontologies, where the latter exploits the proof facilitiesof reasoner ELK. Since justifications are often insufficient in explaininginferences, there is thus only little tool support for explaining inferences inmore expressive DLs. In this paper, we introduce EVEE-LIBS, a Java library forcomputing proofs for DLs up to ALCH, and EVEE-PROTEGE, a collection ofProt\'eg\'e plugins for displaying those proofs in Prot\'eg\'e. We also give ashort glimpse of the latest version of EVONNE, a more advanced standaloneapplication for displaying and interacting with proofs computed with EVEE-LIBS.",Christian Alrabbaa,2022/6/15,2022/6/15,,,"['cs.LO', 'cs.AI']"
2206.00426v1,Semantic Probabilistic Layers for Neuro-Symbolic Learning,http://arxiv.org/abs/2206.00426v1,"We design a predictive layer for structured-output prediction (SOP) that canbe plugged into any neural network guaranteeing its predictions are consistentwith a set of predefined symbolic constraints. Our Semantic Probabilistic Layer(SPL) can model intricate correlations, and hard constraints, over a structuredoutput space all while being amenable to end-to-end learning via maximumlikelihood. SPLs combine exact probabilistic inference with logical reasoningin a clean and modular way, learning complex distributions and restrictingtheir support to solutions of the constraint. As such, they can faithfully, andefficiently, model complex SOP tasks beyond the reach of alternativeneuro-symbolic approaches. We empirically demonstrate that SPLs outperformthese competitors in terms of accuracy on challenging SOP tasks includinghierarchical multi-label classification, pathfinding and preference learning,while retaining perfect constraint satisfaction.",Kareem Ahmed,2022/6/1,2022/6/1,,,"['cs.LG', 'cs.AI']"
2205.14591v2,TAR: Neural Logical Reasoning across TBox and ABox,http://arxiv.org/abs/2205.14591v2,"Many ontologies, i.e., Description Logic (DL) knowledge bases, have beendeveloped to provide rich knowledge about various domains. An ontology consistsof an ABox, i.e., assertion axioms between two entities or between a conceptand an entity, and a TBox, i.e., terminology axioms between two concepts.Neural logical reasoning (NLR) is a fundamental task to explore such knowledgebases, which aims at answering multi-hop queries with logical operations basedon distributed representations of queries and answers. While previous NLRmethods can give specific entity-level answers, i.e., ABox answers, they arenot able to provide descriptive concept-level answers, i.e., TBox answers,where each concept is a description of a set of entities. In other words,previous NLR methods only reason over the ABox of an ontology while ignoringthe TBox. In particular, providing TBox answers enables inferring theexplanations of each query with descriptive concepts, which make answerscomprehensible to users and are of great usefulness in the field of appliedontology. In this work, we formulate the problem of neural logical reasoningacross TBox and ABox (TA-NLR), solving which needs to address challenges inincorporating, representing, and operating on concepts. We propose an originalsolution named TAR for TA-NLR. Firstly, we incorporate description logic basedontological axioms to provide the source of concepts. Then, we representconcepts and queries as fuzzy sets, i.e., sets whose elements have degrees ofmembership, to bridge concepts and queries with entities. Moreover, we designoperators involving concepts on top of fuzzy set representation of concepts andqueries for optimization and inference. Extensive experimental results on tworeal-world datasets demonstrate the effectiveness of TAR for TA-NLR.",Zhenwei Tang,2022/5/29,2022/8/16,,,"['cs.AI', 'cs.LG', 'cs.LO']"
2205.12898v1,Reasoning over Logically Interacted Conditions for Question Answering,http://arxiv.org/abs/2205.12898v1,"Some questions have multiple answers that are not equally correct, i.e.answers are different under different conditions. Conditions are used todistinguish answers as well as to provide additional information to supportthem. In this paper, we study a more challenging task where answers areconstrained by a list of conditions that logically interact, which requiresperforming logical reasoning over the conditions to determine the correctnessof the answers. Even more challenging, we only provide evidences for a subsetof the conditions, so some questions may not have deterministic answers. Insuch cases, models are asked to find probable answers and identify conditionsthat need to be satisfied to make the answers correct. We propose a new model,TReasoner, for this challenging reasoning task. TReasoner consists of anentailment module, a reasoning module, and a generation module (if the answersare free-form text spans). TReasoner achieves state-of-the-art performance ontwo benchmark conditional QA datasets, outperforming the previousstate-of-the-art by 3-10 points.",Haitian Sun,2022/5/25,2022/5/25,,,"['cs.CL', 'cs.AI']"
2205.12598v2,RobustLR: Evaluating Robustness to Logical Perturbation in Deductive Reasoning,http://arxiv.org/abs/2205.12598v2,"Transformers have been shown to be able to perform deductive reasoning on alogical rulebase containing rules and statements written in English naturallanguage. While the progress is promising, it is currently unclear if thesemodels indeed perform logical reasoning by understanding the underlying logicalsemantics in the language. To this end, we propose RobustLR, a suite ofevaluation datasets that evaluate the robustness of these models to minimallogical edits in rulebases and some standard logical equivalence conditions. Inour experiments with RoBERTa and T5, we find that the models trained in priorworks do not perform consistently on the different perturbations in RobustLR,thus showing that the models are not robust to the proposed logicalperturbations. Further, we find that the models find it especially hard tolearn logical negation and disjunction operators. Overall, using our evaluationsets, we demonstrate some shortcomings of the deductive reasoning-basedlanguage models, which can eventually help towards designing better models forlogical reasoning over natural language. All the datasets and code base havebeen made publicly available.",Soumya Sanyal,2022/5/25,2022/11/8,,,"['cs.CL', 'cs.LG', 'cs.LO']"
2205.11502v2,On the Paradox of Learning to Reason from Data,http://arxiv.org/abs/2205.11502v2,"Logical reasoning is needed in a wide range of NLP tasks. Can a BERT model betrained end-to-end to solve logical reasoning problems presented in naturallanguage? We attempt to answer this question in a confined problem space wherethere exists a set of parameters that perfectly simulates logical reasoning. Wemake observations that seem to contradict each other: BERT attains near-perfectaccuracy on in-distribution test examples while failing to generalize to otherdata distributions over the exact same problem space. Our study provides anexplanation for this paradox: instead of learning to emulate the correctreasoning function, BERT has in fact learned statistical features thatinherently exist in logical reasoning problems. We also show that it isinfeasible to jointly remove statistical features from data, illustrating thedifficulty of learning to reason in general. Our result naturally extends toother neural models and unveils the fundamental difference between learning toreason and learning to achieve high performance on NLP benchmarks usingstatistical features.",Honghua Zhang,2022/5/23,2022/5/24,,,"['cs.CL', 'cs.AI']"
2205.11432v3,Logical Reasoning with Span-Level Predictions for Interpretable and Robust NLI Models,http://arxiv.org/abs/2205.11432v3,"Current Natural Language Inference (NLI) models achieve impressive results,sometimes outperforming humans when evaluating on in-distribution test sets.However, as these models are known to learn from annotation artefacts anddataset biases, it is unclear to what extent the models are learning the taskof NLI instead of learning from shallow heuristics in their training data. Weaddress this issue by introducing a logical reasoning framework for NLI,creating highly transparent model decisions that are based on logical rules.Unlike prior work, we show that improved interpretability can be achievedwithout decreasing the predictive accuracy. We almost fully retain performanceon SNLI, while also identifying the exact hypothesis spans that are responsiblefor each model prediction. Using the e-SNLI human explanations, we verify thatour model makes sensible decisions at a span level, despite not using any spanlabels during training. We can further improve model performance and span-leveldecisions by using the e-SNLI explanations during training. Finally, our modelis more robust in a reduced data setting. When training with only 1,000examples, out-of-distribution performance improves on the MNLI matched andmismatched validation sets by 13% and 16% relative to the baseline. Trainingwith fewer observations yields further improvements, both in-distribution andout-of-distribution.",Joe Stacey,2022/5/23,2022/10/21,,,"['cs.CL', 'cs.LG']"
2205.11177v1,"Consistency of UML class, object and statechart diagrams using ontology reasoners",http://arxiv.org/abs/2205.11177v1,"We propose an automatic approach to analyze the consistency andsatisfiability of Unified Modeling Language UML models containing multipleclass, object and statechart diagrams using logic reasoners for the WebOntology Language OWL 2. We describe how to translate UML models in OWL 2 andwe present a tool chain implementing this translation that can be used with anystandard compliant UML modeling tool. The proposed approach is limited inscope, but is fully automatic and does not require any expertise about OWL 2and its reasoners from the designer.",Ali Hanzala Khan,2022/5/23,2022/5/23,,,"['cs.AI', 'cs.CL', 'cs.SE']"
2205.08794v2,LogiGAN: Learning Logical Reasoning via Adversarial Pre-training,http://arxiv.org/abs/2205.08794v2,"We present LogiGAN, an unsupervised adversarial pre-training framework forimproving logical reasoning abilities of language models. Upon automaticidentifying logical reasoning phenomena in massive text corpus via detectionheuristics, we train language models to predict the masked-out logicalstatements. Inspired by the facilitation effect of reflective thinking in humanlearning, we analogically simulate the learning-thinking process with anadversarial Generator-Verifier architecture to assist logic learning. LogiGANimplements a novel sequential GAN approach that (a) circumvents thenon-differentiable challenge of the sequential GAN by leveraging the Generatoras a sentence-level generative likelihood scorer with a learning objective ofreaching scoring consensus with the Verifier; (b) is computationally feasiblefor large-scale pre-training with arbitrary target length. Both base and largesize language models pre-trained with LogiGAN demonstrate obvious performanceimprovement on 12 datasets requiring general reasoning abilities, revealing thefundamental role of logic in broad reasoning, as well as the effectiveness ofLogiGAN. Ablation studies on LogiGAN components reveal the relativeorthogonality between linguistic and logic abilities and suggest thatreflective thinking's facilitation effect might also generalize to machinelearning.",Xinyu Pi,2022/5/18,2022/12/9,,,['cs.CL']
2205.04423v1,Graph Neural Networks for Propositional Model Counting,http://arxiv.org/abs/2205.04423v1,"Graph Neural Networks (GNNs) have been recently leveraged to solve severallogical reasoning tasks. Nevertheless, counting problems such as propositionalmodel counting (#SAT) are still mostly approached with traditional solvers.Here we tackle this gap by presenting an architecture based on the GNNframework for belief propagation (BP) of Kuch et al., extended withself-attentive GNN and trained to approximately solve the #SAT problem. We rana thorough experimental investigation, showing that our model, trained on asmall set of random Boolean formulae, is able to scale effectively to muchlarger problem sizes, with comparable or better performances of state of theart approximate solvers. Moreover, we show that it can be efficientlyfine-tuned to provide good generalization results on different formulaedistributions, such as those coming from SAT-encoded combinatorial problems.",Gaia Saveri,2022/5/9,2022/5/9,,,"['cs.AI', 'cs.LG']"
2205.00731v2,Logiformer: A Two-Branch Graph Transformer Network for Interpretable Logical Reasoning,http://arxiv.org/abs/2205.00731v2,"Machine reading comprehension has aroused wide concerns, since it exploresthe potential of model for text understanding. To further equip the machinewith the reasoning capability, the challenging task of logical reasoning isproposed. Previous works on logical reasoning have proposed some strategies toextract the logical units from different aspects. However, there still remainsa challenge to model the long distance dependency among the logical units.Also, it is demanding to uncover the logical structures of the text and furtherfuse the discrete logic to the continuous text embedding. To tackle the aboveissues, we propose an end-to-end model Logiformer which utilizes a two-branchgraph transformer network for logical reasoning of text. Firstly, we introducedifferent extraction strategies to split the text into two sets of logicalunits, and construct the logical graph and the syntax graph respectively. Thelogical graph models the causal relations for the logical branch while thesyntax graph captures the co-occurrence relations for the syntax branch.Secondly, to model the long distance dependency, the node sequence from eachgraph is fed into the fully connected graph transformer structures. The twoadjacent matrices are viewed as the attention biases for the graph transformerlayers, which map the discrete logical structures to the continuous textembedding space. Thirdly, a dynamic gate mechanism and a question-awareself-attention module are introduced before the answer prediction to update thefeatures. The reasoning process provides the interpretability by employing thelogical units, which are consistent with human cognition. The experimentalresults show the superiority of our model, which outperforms thestate-of-the-art single model on two logical reasoning benchmarks.",Fangzhi Xu,2022/5/2,2022/7/8,,,['cs.CL']
2204.10382v1,"Facilitating automated conversion of scientific knowledge into scientific simulation models with the Machine Assisted Generation, Calibration, and Comparison (MAGCC) Framework",http://arxiv.org/abs/2204.10382v1,"The Machine Assisted Generation, Comparison, and Calibration (MAGCC)framework provides machine assistance and automation of recurrent crucial stepsand processes in the development, implementation, testing, and use ofscientific simulation models. MAGCC bridges systems for knowledge extractionvia natural language processing or extracted from existing mathematical modelsand provides a comprehensive workflow encompassing the composition ofscientific models and artificial intelligence (AI) assisted code generation.MAGCC accomplishes this through: 1) the development of a comprehensivelyexpressive formal knowledge representation knowledgebase, the StructuredScientific Knowledge Representation (SSKR) that encompasses all the types ofinformation needed to make any simulation model, 2) the use of an artificiallyintelligent logic reasoning system, the Computational Modeling Assistant (CMA),that takes information from the SSKR and generates, in a traceable fashion,model specifications across a range of simulation modeling methods, and 3) theuse of the CMA to generate executable code for a simulation model from thosemodel specifications. The MAGCC framework can be customized any scientificdomain, and future work will integrate newly developed code-generating AIsystems.",Chase Cockrell,2022/4/21,2022/4/21,,,"['cs.AI', 'cs.LG']"
2204.08753v1,Table-based Fact Verification with Self-adaptive Mixture of Experts,http://arxiv.org/abs/2204.08753v1,"The table-based fact verification task has recently gained widespreadattention and yet remains to be a very challenging problem. It inherentlyrequires informative reasoning over natural language together with differentnumerical and logical reasoning on tables (e.g., count, superlative,comparative). Considering that, we exploit mixture-of-experts and present inthis paper a new method: Self-adaptive Mixture-of-Experts Network (SaMoE).Specifically, we have developed a mixture-of-experts neural network torecognize and execute different types of reasoning -- the network is composedof multiple experts, each handling a specific part of the semantics forreasoning, whereas a management module is applied to decide the contribution ofeach expert network to the verification result. A self-adaptive method isdeveloped to teach the management module combining results of different expertsmore efficiently without external knowledge. The experimental resultsillustrate that our framework achieves 85.1% accuracy on the benchmark datasetTabFact, comparable with the previous state-of-the-art models. We hope ourframework can serve as a new baseline for table-based verification. Our code isavailable at https://github.com/THUMLP/SaMoE.",Yuxuan Zhou,2022/4/19,2022/4/19,,,"['cs.AI', 'cs.CL', 'cs.LG']"
2204.04680v1,Reasoning with Multi-Structure Commonsense Knowledge in Visual Dialog,http://arxiv.org/abs/2204.04680v1,"Visual Dialog requires an agent to engage in a conversation with humansgrounded in an image. Many studies on Visual Dialog focus on the understandingof the dialog history or the content of an image, while a considerable amountof commonsense-required questions are ignored. Handling these scenarios dependson logical reasoning that requires commonsense priors. How to capture relevantcommonsense knowledge complementary to the history and the image remains a keychallenge. In this paper, we propose a novel model by Reasoning withMulti-structure Commonsense Knowledge (RMK). In our model, the externalknowledge is represented with sentence-level facts and graph-level facts, toproperly suit the scenario of the composite of dialog history and image. On topof these multi-structure representations, our model can capture relevantknowledge and incorporate them into the vision and semantic features, viagraph-based interaction and transformer-based fusion. Experimental results andanalysis on VisDial v1.0 and VisDialCK datasets show that our proposed modeleffectively outperforms comparative methods.",Shunyu Zhang,2022/4/10,2022/4/10,,,"['cs.CV', 'cs.MM']"
2203.14487v1,Enhancing Neural Mathematical Reasoning by Abductive Combination with Symbolic Library,http://arxiv.org/abs/2203.14487v1,"Mathematical reasoning recently has been shown as a hard challenge for neuralsystems. Abilities including expression translation, logical reasoning, andmathematics knowledge acquiring appear to be essential to overcome thechallenge. This paper demonstrates that some abilities can be achieved throughabductive combination with discrete systems that have been programmed withhuman knowledge. On a mathematical reasoning dataset, we adopt the recentlyproposed abductive learning framework, and propose the ABL-Sym algorithm thatcombines the Transformer neural models with a symbolic mathematics library.ABL-Sym shows 9.73% accuracy improvement on the interpolation tasks and 47.22%accuracy improvement on the extrapolation tasks, over the state-of-the-artapproaches. Online demonstration: http://math.polixir.ai",Yangyang Hu,2022/3/28,2022/3/28,,,"['cs.LG', 'cs.AI']"
2203.13953v1,A Densely Connected Criss-Cross Attention Network for Document-level Relation Extraction,http://arxiv.org/abs/2203.13953v1,"Document-level relation extraction (RE) aims to identify relations betweentwo entities in a given document. Compared with its sentence-level counterpart,document-level RE requires complex reasoning. Previous research normallycompleted reasoning through information propagation on the mention-level orentity-level document-graph, but rarely considered reasoning at theentity-pair-level.In this paper, we propose a novel model, called DenselyConnected Criss-Cross Attention Network (Dense-CCNet), for document-level RE,which can complete logical reasoning at the entity-pair-level. Specifically,the Dense-CCNet performs entity-pair-level logical reasoning through theCriss-Cross Attention (CCA), which can collect contextual information inhorizontal and vertical directions on the entity-pair matrix to enhance thecorresponding entity-pair representation. In addition, we densely connectmultiple layers of the CCA to simultaneously capture the features of single-hopand multi-hop logical reasoning.We evaluate our Dense-CCNet model on threepublic document-level RE datasets, DocRED, CDR, and GDA. Experimental resultsdemonstrate that our model achieves state-of-the-art performance on these threedatasets.",Liang Zhang,2022/3/26,2022/3/26,,,['cs.CL']
2203.12186v1,AbductionRules: Training Transformers to Explain Unexpected Inputs,http://arxiv.org/abs/2203.12186v1,"Transformers have recently been shown to be capable of reliably performinglogical reasoning over facts and rules expressed in natural language, butabductive reasoning - inference to the best explanation of an unexpectedobservation - has been underexplored despite significant applications toscientific discovery, common-sense reasoning, and model interpretability.  We present AbductionRules, a group of natural language datasets designed totrain and test generalisable abduction over natural-language knowledge bases.We use these datasets to finetune pretrained Transformers and discuss theirperformance, finding that our models learned generalisable abductive techniquesbut also learned to exploit the structure of our data. Finally, we discuss theviability of this approach to abductive reasoning and ways in which it may beimproved in future work.",Nathan Young,2022/3/23,2022/3/23,,,['cs.CL']
2203.10557v2,A Neural-Symbolic Approach to Natural Language Understanding,http://arxiv.org/abs/2203.10557v2,"Deep neural networks, empowered by pre-trained language models, have achievedremarkable results in natural language understanding (NLU) tasks. However,their performances can drastically deteriorate when logical reasoning isneeded. This is because NLU in principle depends on not only analogicalreasoning, which deep neural networks are good at, but also logical reasoning.According to the dual-process theory, analogical reasoning and logicalreasoning are respectively carried out by System 1 and System 2 in the humanbrain. Inspired by the theory, we present a novel framework for NLU calledNeural-Symbolic Processor (NSP), which performs analogical reasoning based onneural processing and logical reasoning based on both neural and symbolicprocessing. As a case study, we conduct experiments on two NLU tasks, questionanswering (QA) and natural language inference (NLI), when numerical reasoning(a type of logical reasoning) is necessary. The experimental results show thatour method significantly outperforms state-of-the-art methods in both tasks.",Zhixuan Liu,2022/3/20,2022/10/21,,,['cs.CL']
