Paper ID,Title,URL,Summary,First Author,Publish Date,Update Date,Code URL,Stars,Categories
2506.10209v1,TTT-Bench：一个用于评估简单和新颖井字棋风格游戏推理能力的基准测试,http://arxiv.org/abs/2506.10209v1,大型推理模型（LRMs）在包括奥林匹克级别的数学问题在内的广泛任务中展现了惊人的推理能力，这表明了它们复杂的推理能力。尽管许多推理基准集中于STEM领域，但LRMs在更广泛的任务领域中正确推理的能力仍未得到充分探索。在这项工作中，我们引入了\textbf{TTT-Bench}这一新的基准，它通过一套四款两人对弈的井字棋风格游戏来评估LRMs的基本战略、空间和逻辑推理能力，这些游戏是人类从小就能轻松解决的。我们提出了一种简单且可扩展的程序化方法来生成TTT-Bench的可验证两人游戏问题。虽然这些游戏对人类来说微不足道，但要确保胜利，就需要对对手的意图以及游戏板的空间配置进行推理。我们评估了一系列最先进的LRMs，并\textbf{发现那些在难题上表现优异的模型在这些简单的推理游戏中往往失败}。进一步的测试表明，与MATH 500和AIME 2024相比，我们评估的推理模型在TTT-Bench上的平均得分分别下降了41%和5%，其中较大的模型使用较短的推理轨迹实现了更高的性能，而在简单和新的TTT-Bench任务中，大多数模型在长期战略推理方面都显得力不从心。,帕卡米亚·米什拉,2025/6/11,2025/6/11,,,"['cs.CL', 'cs.AI']"
2506.11128v1,更强大的语言模型会产生更接近人类错误的错误。,http://arxiv.org/abs/2506.11128v1,随着语言模型不断改进，它们是否趋向于人类相似的推理模式？我们提供了令人惊讶的证据：尽管整体推理能力随着模型复杂性的增加而提高，但错误本质上的确越来越接近可预测的人类推理谬误：一种以前未曾观察到的反比例现象。为了研究这个问题，我们应用了推理的论题理论（Erotetic Theory of Reasoning，ETR），这是一个经过实证支持的正式认知框架，能够预测人类推理结果。使用开源包PyETR，我们生成了人类容易出错的逻辑推理问题，评估了38个语言模型在383个推理任务中的回答。我们的分析表明，随着模型在一般能力上的提升（以聊天机器人竞技场分数衡量），它们错误回答中符合ETR预测的人类谬误的比例趋于增加（$\rho = 0.360，p = 0.0265$）。值得注意的是，由于我们没有在这些任务中观察到模型复杂性与逻辑正确性之间的相关性，这种错误模式向人类相似性的转变是独立于错误率发生的。这些发现挑战了语言模型按比例扩大就能自然获得规范性理性的主流观点，反而表明模型趋向于人类相似的认知，包括我们特有的偏见和局限性，这一点我们通过展示语言模型推理中的顺序效应进一步得到证实。,安德鲁·基南·理查森,2025/6/10,2025/6/10,,,"['cs.CL', 'cs.AI']"
2506.07288v3,EVINET：通过证据推理网络实现开放世界图学习,http://arxiv.org/abs/2506.07288v3,图学习对于许多现实世界的任务至关重要，但它们通常是在一个封闭世界的假设下被研究的，即所有可能的数据标签都是事先已知的。为了在开放和嘈杂的环境中有效地进行图学习，当模型对已知类别的分布内数据进行错误预测时，即误分类检测，或者当模型遇到来自新颖类别的分布外数据时，即分布外检测，向模型用户告知模型的错误预测是至关重要的。本文介绍了证据推理网络（EVINET），这是一个通过在主观逻辑框架内整合Beta嵌入来应对这两个挑战的框架。EVINET包括两个关键模块：用于误分类检测的失调推理和用于分布外检测的空白推理。大量的实验表明，在分布内分类、误分类检测和分布外检测的任务中，EVINET在多个指标上优于最先进的方法。EVINET证明了不确定性估计和逻辑推理对于误分类检测和分布外检测的必要性，并为开放世界的图学习铺平了道路。我们的代码和数据可在https://github.com/SSSKJ/EviNET上获取。,关威杰,2025/6/8,2025/8/1,,,['cs.LG']
2506.06881v1,KnowCoder-V2：深度知识分析,http://arxiv.org/abs/2506.06881v1,深度知识分析任务通常涉及从大量数据中系统地提取和关联知识，随后通过逻辑推理来发现洞察。然而，为了解决这样的复杂任务，现有的深度研究框架面临着三个主要挑战：1）缺乏知识的系统组织和管理；2）纯在线操作，这使得依赖共享和大规模知识的任务效率低下；3）无法执行复杂的知识计算，限制了其生成有洞察力的分析结果的能力。受到这些挑战的启发，在本文中，我们提出了一种知识增强深度研究（KDR）框架，它赋予了深度研究以深度知识分析能力。具体来说，它引入了一个独立的知识组织阶段，将大规模、领域相关的数据预处理为离线系统化的知识。在此基础上，它扩展了深度研究，增加了一种额外的推理步骤，以在线方式执行复杂的知识计算。为了提高LLM在上述框架中解决知识分析任务的能力，我们进一步引入了知识计算与推理接口（KCII），一个通过统一代码生成桥接知识组织和推理的LLM。对于知识组织，它为预定义的类生成实例代码，将数据转换为知识对象。对于知识计算，它生成分析代码并在上述知识对象上执行，以获得深度分析结果。在六个知识分析任务上超过三十个数据集的实验结果表明了KCII的有效性。此外，当整合到KDR框架中时，与主流深度研究框架相比，KCII能够生成高质量的报告，其中包含有洞察力的分析结果。,李子萱,2025/6/7,2025/6/7,,,['cs.AI']
2506.03984v1,环游世界24小时：探究大型语言模型对时间和地点的认知,http://arxiv.org/abs/2506.03984v1,在时间和空间维度上进行推理对于理解我们的世界至关重要。然而，在此领域，语言模型的能力在很大程度上尚未被探索，因为以往的工作主要测试了它们在孤立或简单或人工环境中的逻辑推理能力。在这篇论文中，我们提出了对语言模型联合进行时间和空间推理能力的首次评估。为了使我们的分析成为可能，我们创建了GeoTemp数据集，该数据集包含320k个提示，涵盖217个国家的289个城市和37个时区。使用GeoTemp，我们评估了八个不同模型家族的八种开放聊天模型，以评估不同时间和地理知识的组合。我们发现，大多数模型在仅涉及时间知识的推理任务上表现良好，而且整体性能随着规模的增加而提高。然而，在需要连接时间和地理信息的工作中，性能仍然受限。我们没有发现与特定地理区域明显相关的性能。相反，我们发现对于模型困惑度低的地点名称，性能有显著提升，这表明它们在模型训练期间反复出现。我们进一步证明，它们的性能受提示制定的影响很大——直接注入地理知识可以提升性能，而令人惊讶的是，像思维链提示这样的技术却在简单的任务中降低了性能。,"Carolin Holtermann

卡罗琳·霍尔特曼",2025/6/4,2025/6/4,,,['cs.CL']
2506.03771v1,《迈向蕴涵检查：探索特征标记搜索》,http://arxiv.org/abs/2506.03771v1,逻辑蕴涵对于推理至关重要，但蕴涵检查的最坏情况复杂度是变量大小的指数级。随着最近的发展，当量子计算成熟时，可能会为各种组合问题提供有效的方法，包括蕴涵检查。Grover算法通过Grover操作、选择性相位反转和振幅放大来处理对非结构化数据的搜索，其效率比经典方法提高了平方级。其原始形式旨在解决单胜者场景：保证恰好有一个匹配。将其扩展到多胜者场景时，通过概率控制Grover操作的应用次数，而未胜者情况则通过超时处理。我们的研究探索了“特征标记”方法的多种方案。虽然仍然依赖于Grover操作，但这种方法引入了额外的量子比特来标记特征状态。标记的特征状态有助于解释测量结果，并增强对未胜者情况的识别（与蕴涵语境中的无逻辑违规相关）。我们的研究在IBM Aer模拟器上对双量子比特系统进行了三种特征标记变体的实验。结果显示，所有方案都具有很强的可区分性，在最坏情况下最佳相对可区分性为19，在平均情况下为53。我们的发现揭示了一种可行的量子机制，可以区分未胜者情况与其他场景，这可能在蕴涵检查和一般逻辑推理中发挥关键作用。,塔通·卡塔纽库尔,2025/6/4,2025/6/4,,,"['quant-ph', 'cs.ET', 'cs.LO']"
2506.03295v2,通过在一个问题上进行批判性微调，释放预训练大型语言模型（LLMs）的推理潜能,http://arxiv.org/abs/2506.03295v2,我们目睹了像Qwen-Math、MiMo和Phi-4这样的强大型语言模型（LLM）在预训练阶段就具备了巨大的推理潜力。通过强化学习（RL），这些模型在推理任务上的表现可以大幅提升。近期的研究表明，即使是针对单个问题的RL也能充分释放这些模型的推理能力。然而，RL不仅成本高昂，而且不够稳定。即使是单次RL也需要数百个GPU小时。这引发了一个关键问题：是否有更有效的方式来释放这些强大基LLM的推理潜力？在本工作中，我们展示了通过针对单个问题进行的批判性微调（CFT）可以有效释放LLM的推理潜力。我们的方法通过收集针对单个问题产生的多种模型解决方案，并使用教师LLM提供详细的批判来构建批判数据。我们在CFT数据上对从1.5B到14B参数的Qwen和Llama家族模型进行了微调，并观察到在多样化的推理任务上性能显著提升。例如，仅用5个GPU小时的训练时间，Qwen-Math-7B-CFT在六个数学基准测试上平均提高了15%，在三个逻辑推理基准测试上提高了16%。这些结果与RL的效果相当，甚至更好，而所需的计算量只是RL的1/20。消融研究揭示了单次CFT在针对不同提示问题的鲁棒性。这些结果突出了单次CFT作为一种简单、通用且计算高效的释放现代LLM推理能力的方法。,王宇博,2025/6/3,2025/6/5,,,"['cs.CL', 'cs.LG']"
2506.02690v1,面向大型模型时代的几何问题求解：综述,http://arxiv.org/abs/2506.02690v1,几何问题求解（GPS）是人工智能中的一个关键前沿领域，在教育、计算机辅助设计和计算图形学等领域有着深远的应用。尽管其意义重大，但由于对空间理解和严谨逻辑推理的双重需求，自动化GPS仍然具有挑战性。近年来，大型模型的发展使得在SAT级问题上有显著的突破，但该领域在方法、基准和评估框架上仍然存在碎片化。这篇综述系统地总结了GPS的进展，通过三个核心维度：1）基准构建；2）文本和图表解析；3）推理范式。我们进一步提出了一种统一的分析范式，评估了当前的局限性，并确定了未来研究的新机遇，以指导向人类水平几何推理迈进，包括自动基准生成和可解释的神经符号集成。,赵雨瑞,2025/6/3,2025/6/3,,,"['cs.CV', 'math.GT']"
2505.23977v1,视觉斯芬克斯：用于强化学习的大规模合成视觉逻辑谜题,http://arxiv.org/abs/2505.23977v1,视觉语言模型（VLMs）预计能够进行有效的多模态推理并做出逻辑上连贯的决策，这对于诸如图表理解和空间问题解决等任务至关重要。然而，当前VLM的推理缺乏大规模和结构良好的训练数据集。为了填补这一空白，我们提出了VisualSphinx，这是一种前所未有的大规模合成视觉逻辑推理训练数据。为了应对具有接地答案的图像合成的挑战，我们提出了一种从规则到图像的合成流程，该流程从种子问题中提取和扩展拼图规则，并为拼图样本组装生成接地合成图像合成的代码。实验表明，在VisualSphinx上使用GRPO训练的VLM得益于我们数据集的逻辑一致性和可读性，并在逻辑推理任务上表现出改进的性能。从VisualSphinx开发出的增强推理能力也惠及其他推理任务，如代数推理、算术推理和几何推理。,冯一尘,2025/5/29,2025/5/29,,,"['cs.CV', 'cs.AI', 'cs.LG']"
2505.23648v1,持续的思维链能够实现并行探索和推理。,http://arxiv.org/abs/2505.23648v1,当前的语言模型通过自回归地从一个有限词汇表中采样标记来生成思维链迹。虽然这种离散采样已经取得了显著的成功，但使用连续值的标记（CoT2）进行思维链提供了更丰富、更具有表现力的替代方案。我们的工作通过需要内在搜索能力的逻辑推理任务来考察CoT2的优点，并为CoT2提供优化和探索方法。理论上，我们表明CoT2允许模型并行跟踪多个轨迹，并量化其在推理效率方面的好处。值得注意的是，一个配备CoT2的一层Transformer可以在足够的嵌入维度下，证明性地解决组合“子集和问题”。这些见解导致了一种新颖而有效的监督策略，其中我们将softmax输出与一组目标轨迹的实证标记分布相匹配。补充这一策略，我们引入了采样策略，以解锁CoT2的政策优化和自我改进。我们的第一种策略在每一步解码时采样和组合$K$个离散标记，以控制并行程度，当$K=1$时，它简化为标准的CoT。我们的第二种策略依赖于在概率单纯形上的连续探索。实验证实，带有CoT2的政策优化确实提高了模型的性能，超过了其初始的离散或连续监督。,哈利勒·阿尔彭·戈泽滕,2025/5/29,2025/5/29,,,['cs.LG']
2505.21398v1,小学阶段基础人工智能素养的“结构化脱插”教学法,http://arxiv.org/abs/2505.21398v1,年轻一代在一个日益由智能技术塑造的世界中成长起来，因此，在早期培养对人工智能的识读能力对于掌握批判性地理解和导航这些技术所必需的技能至关重要。然而，在这个领域的教育往往强调基于工具的学习，优先考虑使用而非理解其背后的概念。这种知识的缺乏使非专业人士，尤其是儿童，容易产生误解、不切实际的期望，以及在识别偏见和刻板印象方面遇到困难。在这篇论文中，我们提出了一种结构化和可复制的教学方法，通过利用与小学课程紧密相关且引人入胜的核心数学元素，来培养小学生的基础人工智能识读能力，以加强概念化、数据表示、分类推理和人工智能的评价。为了评估我们方法的有效性，我们进行了一项实证研究，涉及两个班级的31名五年级学生，通过后测和满意度调查评估他们的进步。我们的结果表明，学生在术语理解和运用、特征描述、逻辑推理和评估技能方面有所提高，他们对决策过程及其局限性的理解也更加深入。此外，这种方法证明了其吸引力，学生们尤其喜欢将人工智能概念与现实世界推理联系起来的活动。材料链接：https://github.com/tail-unica/ai-literacy-primary-ed。,玛丽亚·克里斯蒂娜·卡利斯奇,2025/5/27,2025/5/27,,,"['cs.AI', 'cs.ET']"
2505.19797v3,《复仇者联盟》：将小型语言模型联合起来挑战专有巨头的简单配方,http://arxiv.org/abs/2505.19797v3,专有巨头正在越来越大地主导着对更大语言模型的竞争。开源的小型模型能否在广泛的任务中保持竞争力？在这篇论文中，我们提出了“复仇者”——一个利用这些小型模型集体智慧的简单方法。复仇者基于四个轻量级操作：（一）嵌入：使用文本嵌入模型编码查询；（二）聚类：根据查询的语义相似性进行分组；（三）评分：在每个聚类中对每个模型的性能进行评分；（四）投票：通过重复采样和投票来改进输出。在推理时，每个查询都被嵌入并分配到其最近的聚类。在该聚类中表现最好的模型被选中，通过重复采样生成响应。令人瞩目地，使用10个开源模型（每个模型约7亿参数），复仇者在涵盖数学、编码、逻辑推理、常识和情感任务等15个不同数据集的平均性能上超过了GPT-4o、4.1和4.5。特别是，它在数学任务上比GPT-4.1高出18.21%，在编码任务上高出7.46%。此外，复仇者展现了出色的泛化能力，并且在其唯一的参数——聚类数量——的各个值下，在各种嵌入模型、聚类算法、集成策略中都保持了鲁棒性。,张一群,2025/5/26,2025/6/18,,,['cs.CL']
2505.15817v2,通过混合思维进行逻辑推理的学习,http://arxiv.org/abs/2505.15817v2,人类天生会利用多种推理方式来学习和解决逻辑问题，即不同的表示格式，如自然语言、代码和符号逻辑。相比之下，大多数现有的基于大型语言模型（LLM）的方法在训练过程中通常只使用单一的推理方式，通常是自然语言。尽管一些方法在推理时探索了模态选择或增强，但训练过程仍然是模态盲的，限制了模态之间的协同作用。为了填补这一空白，我们提出了“混合思维”（MoT）框架，它使LLM能够跨越三种互补的模态进行推理：自然语言、代码以及一种新引入的符号模态——真值表，它系统地列举逻辑情况并部分缓解了自然语言推理中的关键失败模式。MoT采用两阶段设计：（1）自进化的MoT训练，它从不同模态的过滤和自我生成的理由中联合学习；（2）MoT推理，它充分利用三种模态的协同作用，产生更好的预测。在FOLIO和ProofWriter等逻辑推理基准测试上的实验表明，我们的MoT框架在一致性上显著优于具有单一模态思维链方法的强大LLM基线，平均准确率提升高达+11.7pp。进一步的分析表明，我们的MoT框架对训练和推理阶段都有益；它在更困难的逻辑推理问题上的效果尤其显著；不同的模态贡献了互补的优势，其中真值表推理有助于克服自然语言推理中的关键瓶颈。,通正,2025/5/21,2025/6/9,,,['cs.CL']
2505.12766v1,推理-OCR：大型多模态模型能否解决由OCR提示的复杂逻辑推理问题？,http://arxiv.org/abs/2505.12766v1,大型多模态模型（LMMs）在功能上变得越来越多样化，并伴随着令人印象深刻的OCR（光学字符识别）相关能力。现有的OCR相关基准主要强调评估LMMs在相对简单的视觉问答、视觉-文本解析等方面的能力。然而，LMMs基于OCR线索处理复杂逻辑推理问题的程度相对未被充分探索。为此，我们引入了Reasoning-OCR基准，它挑战LMMs基于从丰富的视觉-文本中提取的线索解决复杂推理问题。Reasoning-OCR涵盖了六个视觉场景，并包含150个精心设计的题目，这些题目被分为六个推理挑战。此外，Reasoning-OCR最小化了专业领域知识的影响。我们的评估为不同推理挑战中的专有和开源LMM提供了一些见解，强调了提高推理性能的紧迫性。我们希望Reasoning-OCR能够激发并促进基于OCR线索增强复杂推理能力的研究。Reasoning-OCR在https://github.com/Hxyz-123/ReasoningOCR上公开可用。,海斌河,2025/5/19,2025/5/19,,,['cs.CV']
2505.12307v1,LogicOCR：您的多模态大模型在处理富含文本的图像上的逻辑推理能力如何？,http://arxiv.org/abs/2505.12307v1,最近在大型多模态模型（LMMs）方面的进展显著提高了它们的推理和光学字符识别（OCR）能力。然而，它们在涉及丰富文本图像的复杂逻辑推理任务上的表现仍然未被充分探索。为了填补这一空白，我们引入了LogicOCR，这是一个包含1100道多选题的基准，旨在评估LMMs在文本丰富图像上的逻辑推理能力，同时最大限度地减少对特定领域知识的依赖（例如数学）。我们通过从中国国家公务员考试中精选文本语料库并开发一个可扩展的、自动化的流水线来构建LogicOCR，将文本语料库转换为多模态样本。首先，我们设计提示模板，引导GPT-Image-1生成具有多样化背景、交错文本-插图布局和不同字体的图像，确保语境相关性和视觉真实性。然后，生成的图像被人工验证，低质量的示例被淘汰。我们在思维链（CoT）和直接回答两种设置下评估了一系列代表性的开源和专有LMMs。我们的多维分析揭示了关键见解，例如测试时缩放的影响、输入模态差异以及对视觉-文本方向敏感性的影响。值得注意的是，与仅文本输入相比，LMMs在多模态推理方面仍然落后，这表明它们还没有完全弥合视觉阅读与推理之间的差距。我们希望LogicOCR将成为推动多模态推理研究的有价值资源。数据集可在https://github.com/MiliLab/LogicOCR上获取。,毛源益,2025/5/18,2025/5/18,,,"['cs.CV', 'cs.CL']"
2505.12284v1,通过长度感知优化实现推理模型的效率强化学习训练,http://arxiv.org/abs/2505.12284v1,大型推理模型，如OpenAI o1或DeepSeek R1，在推理任务上展现出非凡的表现，但通常需要漫长的推理路径，这带来了显著的内存和时间开销。现有的方法主要通过引入额外的训练数据和阶段来缩短推理路径。在本文中，我们提出了三个关键性的奖励设计，这些设计直接整合到大型推理模型的强化学习过程中，能够在不增加额外训练阶段的情况下缩短响应长度。在四个设置上的实验表明，我们的方法显著缩短了响应长度，同时保持了甚至提升了性能。具体来说，在逻辑推理设置中，我们实现了平均每步响应长度降低40%，性能提升了14%。对于数学问题，我们平均每步响应长度降低了33%，同时保持了性能。,袁丹龙,2025/5/18,2025/5/18,,,"['cs.AI', 'cs.CL']"
2505.12275v1,课程归因学习,http://arxiv.org/abs/2505.12275v1,归因学习（ABL）将机器学习与逻辑推理相结合，形成一个循环：学习模型从原始输入中预测符号概念标签，然后通过归因利用领域知识对这些标签进行修正，并将其反馈用于重新训练。然而，由于归因的不确定性，训练过程往往不稳定，特别是在知识库大而复杂时，这会导致一个难以承受的归因空间。虽然先前的研究专注于改进该空间内的候选者选择，但它们通常将知识库视为一个静态的黑盒。在这项工作中，我们提出了课程归因学习（C-ABL），这是一种方法，它明确地利用知识库的内部结构来解决ABL训练挑战。C-ABL将知识库划分为一系列子库，在训练过程中逐步引入。这减少了整个训练过程中的归因空间，并使模型能够逐步、平滑地引入逻辑。在多个任务上的实验表明，C-ABL优于之前的ABL实现，显著提高了训练稳定性、收敛速度和最终精度，尤其是在复杂知识设置下。,胡文超,2025/5/18,2025/5/18,,,"['cs.LG', 'cs.AI']"
2505.13529v1,桶（BARREL）：基于边界的用于事实和可靠低秩匹配的推理,http://arxiv.org/abs/2505.13529v1,近年来，大型推理模型（LRMs）在数学和逻辑推理方面的能力展现出了令人印象深刻的进步。然而，当前的LRM很少承认无知或以“我不知道”作为回应。相反，它们往往在表现出过度自信的同时产生错误的答案，引发了对其事实可靠性的担忧。在这项工作中，我们识别出两种由过度思考导致的病理推理模式，这些模式导致了过度自信和错误的答案：临时猜测和反复思考。为了解决这些问题，我们提出了BARREL——一个促进简洁和边界感知事实推理的新框架。我们的实验表明，BARREL训练将DeepSeek-R1-Distill-Llama-8B的可靠性从39.33%提高到61.48%，同时仍然实现了与在R1生成的推理数据上微调的模型相当的性能。这些结果证明了我们的初步研究对于构建更可靠和事实性的系统2 LRMs具有启发意义。,杨峻骁,2025/5/18,2025/5/18,,,"['cs.AI', 'cs.CL', 'cs.LG']"
