Paper ID,Title,URL,Summary,First Author,Publish Date,Update Date,Code URL,Stars,Categories
2505.11854v1,评估大型推理模型的逻辑推理能力,http://arxiv.org/abs/2505.11854v1,大型推理模型，通常在长链思维（longCoT）数据上通过强化学习进行后训练，在数学、编码和领域特定推理基准测试中取得了最先进的性能。然而，它们的逻辑推理能力——这是人类认知的基础，并且独立于领域知识——仍被研究不足。为了填补这一空白，我们引入了LogiEval，这是一个全面评估大型推理模型中逻辑推理能力的基准。LogiEval涵盖了多种推理类型（演绎、归纳、类比和溯因推理）以及多种任务格式（例如，逻辑序列、论证分析），这些内容来自高质量的人类考试（例如，LSAT、GMAT）。我们的实验表明，现代推理模型在四选一论证分析问题和类比推理方面表现出色，超越了人类的表现，但在不同推理类型和格式上的能力参差不齐，凸显了它们泛化能力的局限性。我们的分析显示，人类的表现并不与模型失败分布相匹配。为了促进进一步的研究，我们精心制作了LogiEval-Hard，这是一个通过新颖的筛选范式确定的具有挑战性的子集，其中小型模型失败（Qwen3-30B-A3B）可靠地预测了大型模型的困难。现代模型在LogiEval-Hard上的失败非常明显且一致。这表明基本的推理瓶颈在模型规模上仍然存在，并将LogiEval-Hard确立为诊断工具和推进大型语言模型中逻辑推理的严格测试平台。,刘汉萌,2025/5/17,2025/5/17,,,['cs.AI']
2505.09862v1,修辞XAI：通过修辞设计解释AI的好处及其应用,http://arxiv.org/abs/2505.09862v1,本文探讨了将修辞设计融入可解释人工智能（XAI）系统设计中的潜在益处。虽然XAI传统上围绕解释个别预测或整体系统行为来构建，但解释也作为一种论证形式存在，影响着用户评估系统的感知有用性、可信度和培养适当的信任。修辞设计提供了一个有用的框架来分析AI系统和用户之间解释的沟通作用，重点关注以下三个方面：（1）通过不同类型的解释传达的逻辑推理，（2）系统及其开发者展现的可信度，以及（3）在用户中引发的情感共鸣。这些修辞诉求共同帮助我们理解解释如何影响用户感知并促进AI的采用。本文综合了先前XAI工作中的设计策略，这些策略与这三个修辞诉求相一致，并突出了将修辞设计整合到XAI设计中的机遇和挑战。,刘厚江,2025/5/14,2025/5/14,,,"['cs.HC', 'cs.CY']"
2505.03668v1,随着时间的推移，学习符号持久宏操作的POMDP求解,http://arxiv.org/abs/2505.03668v1,本文提出了一种将时态逻辑推理与部分可观测马尔可夫决策过程（POMDPs）相结合的方法，以实现具有宏观动作的不确定性可解释决策。我们的方法利用基于事件演算（EC）的线性时态逻辑（LTL）片段生成持久（即恒定）的宏观动作，这些动作指导基于蒙特卡洛树搜索（MCTS）的POMDP求解器在时间范围内进行搜索，显著减少了推理时间，同时确保了稳健的性能。这些宏观动作通过归纳逻辑编程（ILP）从少量执行轨迹（信念-动作对）中学习，从而消除了手动设计启发式算法的需要，并且只需要指定POMDP转换模型。在Pocman和Rocksample基准场景中，与我们学习的宏观动作相比，时间无关的启发式算法表现出更高的表达性和泛化能力，确实提供了显著的计算效率提升。,塞莱斯提·维罗内塞,2025/5/6,2025/5/6,,,['cs.AI']
2504.21088v1,使用红外温度计进行城市生物群落温度测绘：一种探究式物理教育的调查方法,http://arxiv.org/abs/2504.21088v1,近年来，地球上极端天气事件的频率显著增加。这一现象是由人类活动引起的温室效应加剧所驱动的，导致城市环境中的温度变化，影响热舒适度和生活质量。在此背景下，本研究利用红外温度计对城市生物群落进行温度测绘，这是在第21届全国科技活动周期间提供的一项动手工作坊的一部分。这一举措涉及公立学校的学生，并基于物理教育，旨在培养科学素养。参与者参与了基于问题的学习体验，积极投入到知识构建的各个阶段。目标是检验植被存在与其对城市环境温度影响之间的关系。采用了定性和定量相结合的方法论，使人们能够识别科学素养指标，如信息排序、数据组织、逻辑推理、假设形成、论证和现象解释。对学生陈述和活动指南的分析提供了他们批判性思维发展的见解。研究结果指出，学生发展了理解物理和环境现象的基本技能，有效地将收集到的数据与科学概念联系起来，并提出了有充分支持的解释。此外，这一经历加强了科学作为动态和探究过程的认知，培养了好奇心，提高了学生的辩论能力。因此，这个工作坊被证明是促进科学素养和让参与者参与城市环境中的环境影响研究的一种有效策略。,韦尔京顿·法比西奥·多斯·桑托斯·科斯塔,2025/4/29,2025/4/29,,,['physics.ed-ph']
2504.19852v2,自然指定和验证序列算法的正式框架,http://arxiv.org/abs/2504.19852v2,当前算法形式化验证的方法面临重要局限。在规格说明方面，它们无法自然、简洁地表达算法，尤其是对于具有状态和灵活控制流的算法。在验证方面，基于Hoare逻辑的形式化证明无法反映自然证明的逻辑结构。为了应对这些挑战，我们引入了一个用于在Coq中自然指定和验证顺序算法的正式框架。我们使用状态关系算子来整合Coq的表达式类型系统与命令式语言的灵活控制流。它支持非确定性操作和可自定义的程序状态，使算法能在适当的抽象级别上被指定。在验证方面，我们为算子构建了Hoare逻辑，并提出了一种新颖的两阶段证明方法，该方法将自然逻辑推理与机械组合分离。它反映了自然证明的逻辑结构，增强了模块化和可读性。我们通过形式化深度优先搜索（DFS）算法和验证Knuuth-Morris-Pratt（KMP）算法来评估该框架。,杨成曦,2025/4/28,2025/4/30,,,['cs.PL']
2504.16117v1,上下文感知和罕见事件的解释性，以发现和形式化关键故障模式,http://arxiv.org/abs/2504.16117v1,视觉系统越来越多地被部署在关键领域，如监控、执法和交通。然而，它们对罕见或不可预见的场景的脆弱性带来了显著的安全风险。为了应对这些挑战，我们引入了基于本体的、由人类辅助的发现框架“情境意识与罕见事件解释”（CAIRO），用于检测和形式化故障案例（或称为CP - 关键现象）。设计上，CAIRO鼓励在测试和评估由误判、对抗攻击和AI黑盒模型中的幻觉引发的关键性时，引入人类参与。我们对自动驾驶系统（ADS）中目标检测模型失败的稳健分析，展示了将观察到的摄像机感知与现实世界背景之间的差距形式化的可扩展和可解释方法，这些测试案例以显式知识图（以OWL/XML格式）的形式存储，便于共享、下游分析、逻辑推理和问责制。,斯里德维·波拉瓦拉姆,2025/4/18,2025/4/18,,,"['cs.CV', 'cs.AI', 'cs.HC']"
2504.12749v1,LAD-Reasoner：小型多模态模型在逻辑异常检测方面是优秀的推理者。,http://arxiv.org/abs/2504.12749v1,最近在工业异常检测领域的进展突显了进行深度逻辑异常分析的需求，这需要识别并解释物体、计数和空间配置之间意外的关系。现有方法往往依赖于大规模的外部推理模块或复杂的流水线设计，这阻碍了实际部署和可解释性。为了解决这些局限性，我们引入了一个新的任务，即推理逻辑异常检测（RLAD），它通过结合逻辑推理扩展了传统的异常检测。我们提出了一种新的框架，LAD-Reasoner，这是一个基于Qwen2.5-VL 3B的定制小型多模态语言模型。我们的方法采用两阶段训练范式，首先使用监督微调（SFT）进行细粒度视觉理解，然后使用组相对策略优化（GRPO）来细化逻辑异常检测并强制执行连贯、易于理解的理由。关键的是，奖励信号既来自检测精度也来自输出结构的质量，从而避免了构建思维链（CoT）推理数据的需求。在MVTec LOCO AD数据集上的实验表明，尽管LAD-Reasoner的规模显著减小，但在准确性和F1分数上与Qwen2.5-VL-72B相当，并且在产生简洁和可解释的理由方面表现更出色。这种统一的设计减少了对外部大型模型和复杂管道的依赖，同时为逻辑异常检测提供了透明和可解释的见解。代码和数据将公开发布。,李巍佳,2025/4/17,2025/4/17,,,['cs.CV']
2504.11008v2,MediSee：基于推理的医学图像像素级感知,http://arxiv.org/abs/2504.11008v2,尽管在像素级医学图像感知方面取得了显著的进步，现有方法要么局限于特定任务，要么高度依赖于准确的边界框或文本标签作为输入提示。然而，对输入所需的医学知识对于普通大众来说是一个巨大的障碍，这极大地降低了这些方法的普遍性。与这些领域特定的辅助信息相比，普通用户更倾向于依赖需要逻辑推理的口头查询。在这篇论文中，我们介绍了一个新的医学视觉任务：医学推理分割与检测（MedSD），该任务旨在理解关于医学图像的隐含查询，并为目标对象生成相应的分割掩码和边界框。为了完成这个任务，我们首先介绍了一个多视角、逻辑驱动的医学推理分割与检测（MLMR-SD）数据集，其中包含大量的医学实体目标和相应的推理。此外，我们提出了MediSee，这是一个为医学推理分割与检测设计的有效基线模型。实验结果表明，提出的方法可以有效解决MedSD的隐含口语查询问题，并优于传统的医学指代分割方法。,秦月桐,2025/4/15,2025/4/23,,,"['cs.CV', 'cs.AI']"
2504.10885v1,PuzzleBench：用于大型多模态拼图求解模型的全动态评估框架,http://arxiv.org/abs/2504.10885v1,"大型多模态模型（LMMs）在广泛的多模态任务中展示了令人印象深刻的性能，在各种评估基准上实现了持续提升。然而，现有的基准通常是静态的，并且往往与预训练数据集重叠，导致固定的复杂性约束和严重的数据污染问题。同时，手动标注的数据集劳动密集、耗时，且容易受到人类偏见和不一致性的影响，导致可靠性和可重复性问题。为了解决这些问题，我们提出了一种完全动态的多模态评估框架，命名为开放式视觉拼图生成（OVPG），旨在自动生成新鲜、多样且可验证的评估数据，用于拼图解决任务。具体来说，OVPG流程包括原材料采样模块、视觉内容生成模块和拼图规则设计模块，确保每个评估实例都是原始的、高度随机化的且独特可解的，从而能够持续适应LMMs的能力发展。基于OVPG，我们构建了PuzzleBench，这是一个动态且可扩展的基准，包含11,840个VQA样本。它包含六个精心设计的拼图任务，针对LMMs的三个核心能力：视觉识别、逻辑推理和上下文理解。PuzzleBench与静态基准不同，后者很快就会过时。它通过OVPG和丰富的开放式拼图设计实现数据集的持续更新，从而能够无缝适应LMMs的能力发展。",张泽宇,2025/4/15,2025/4/15,,,"['cs.CV', 'cs.AI']"
2504.09058v1,朝着逐步构建领域知识驱动的推理优化和反思改进,http://arxiv.org/abs/2504.09058v1,最近，对思维链（CoTs）的逐步监督在需要逻辑推理的任务，如编程和数学方面取得了提升，这得益于蒙特卡洛树搜索（MCTS）。然而，它在需要特定领域专业知识和知识方面的贡献尚未得到探索。受此启发，我们识别了在当前背景下纯MCTS的几个潜在挑战，并提出了逐步领域知识驱动推理优化框架，利用MCTS算法为需要基本理解、推理和专业知识的问题开发步骤级监督。此外，我们还引入了面向反思路径的偏好优化，它从更好的视角迭代地学习对推理思想的自我反思。我们进行了广泛的实验来评估这些方法的优势。实证结果表明，这些方法在各个法律领域问题上的有效性。我们还报告了一系列有价值的发现，希望激发对特定领域LLMs和MCTS研究的热情。,刘成原,2025/4/12,2025/4/12,,,"['cs.AI', 'cs.CL']"
2504.05419v1,推理模型知道何时自己是正确的：探查隐藏状态以进行自我验证,http://arxiv.org/abs/2504.05419v1,推理模型在数学和逻辑推理等任务上取得了显著的表现，这得益于它们在推理过程中的搜索能力。然而，它们仍然存在过度思考的问题，即使在得出正确答案后，也会进行不必要的推理步骤。这引发了这样一个问题：模型能否在推理过程中评估中间答案的正确性？在这项工作中，我们研究推理模型是否通过探测模型的隐藏状态来编码关于答案正确性的信息。产生的探测可以以高精度验证中间答案，并产生高度校准的分数。此外，我们发现模型的隐藏状态编码了未来答案的正确性，使得在中间答案完全形成之前就能提前预测其正确性。然后，我们将探测用作验证器，在推理过程中决定是否在中间答案时退出推理，从而将推理标记数减少了24%，而不影响性能。这些发现证实了推理模型确实编码了正确性的概念，但尚未充分利用它，揭示了提高其效率的大量未开发潜力。,张安琪,2025/4/7,2025/4/7,,,"['cs.AI', 'cs.CL']"
2504.04702v1,通过梯度下降学习多数布尔逻辑的语言模型可证失败,http://arxiv.org/abs/2504.04702v1,基于Transformer架构的近期进步，在自然语言处理任务中带来了令人印象深刻的突破，例如GPT-4、Claude和Gemini等模型展示了达到人类水平推理能力。然而，尽管这些模型性能出色，但对其固有限制的担忧仍然存在，尤其是在学习基本逻辑函数方面。尽管复杂性理论分析表明，由于Transformer属于$\mathsf{TC}^0$类，它可以自然地表示简单的逻辑函数（例如$\mathsf{AND}$、$\mathsf{OR}$和多数门），但这些结果基于理想的参数设置，并未考虑基于梯度下降的训练方法带来的约束。在本研究中，我们探讨了在采用基于梯度的训练方法时，Transformer是否真的可以学习简单的多数函数。我们关注Transformer架构的简化变体，并考虑了$n=\mathrm{poly}(d)$和$n=\exp(\Omega(d))$数量的训练样本，其中每个样本都是一个与基本多数函数输出配对的$d$位二进制字符串。我们的分析表明，即使在进行了$\mathrm{poly}(d)$次梯度查询之后，Transformer模型的泛化误差仍然相当大，随着$d$的增大而呈指数增长。这项工作突出了训练Transformer进行最简单的逻辑推理任务时存在的根本优化挑战，并为它们的理论限制提供了新的见解。,"抱歉，""Bo Chen"" 这个词组是一个人名，通常不需要翻译，因为它是一个专有名词。但如果您希望知道这个名字的中文发音，那么可以读作“波 陈”。在中文语境中，人们可能会按照拼音来称呼这个名字。",2025/4/7,2025/4/7,,,"['cs.LG', 'cs.AI', 'cs.CC']"
2504.02826v4,想象超越像素：基准测试基于推理的视觉编辑,http://arxiv.org/abs/2504.02826v4,大型多模态模型（LMMs）在视觉理解和生成方面取得了显著进展，但它们在通用视觉编辑方面仍面临挑战，尤其是在遵循复杂指令、保持外观一致性和支持灵活的输入格式方面。为了研究这一差距，我们引入了RISEBench，这是第一个用于评估基于推理的视觉编辑（RISE）的基准。RISEBench专注于四个关键推理类别：时间推理、因果关系推理、空间推理和逻辑推理。我们对每个类别精心制作了高质量的测试案例，并提出了一个稳健的评估框架，该框架通过人类评判者和LMM作为评判者的方法，评估指令推理、外观一致性和视觉合理性。我们进行了实验，评估了九个杰出的视觉编辑模型，包括开源和专有模型。评估结果表明，当前模型在基于推理的编辑任务中面临重大挑战。即使是最强大的模型GPT-4o-Image，其准确率也只有28.8%。RISEBench有效地突出了当代编辑模型的局限性，提供了宝贵的见解，并为推理感知视觉编辑领域的未来发展方向指明了路径。我们的代码和数据已在https://github.com/PhoenixZ810/RISEBench发布。,赵祥宇,2025/4/3,2025/5/27,,,['cs.CV']
2503.23064v2,VGRP-Bench：大型视觉-语言模型的可视化网格推理谜题基准,http://arxiv.org/abs/2503.23064v2,大型视觉语言模型（LVLMs）在解决需要精确感知、规则理解和逻辑推理的谜题时存在困难。评估和提升它们在这个领域的表现至关重要，因为这反映了它们进行结构化推理的能力——这是解决现实世界问题的必备技能。然而，现有的基准测试主要评估未经额外训练或微调的预训练模型，往往缺乏对推理的专门关注，并且未能建立系统性的评估框架。为了解决这些局限性，我们介绍了VGRP-Bench，这是一个包含20个不同谜题的视觉网格推理谜题基准。VGRP-Bench涵盖了多个难度级别，并不仅对现有的聊天LVLMs（例如GPT-4o）进行了广泛实验，还针对推理LVLMs（例如Gemini-Thinking）进行了实验。我们的结果显示，即使是处于顶尖水平的LVLMs在这些谜题上也存在困难，凸显了它们在解决谜题方面的基本局限性。最重要的是，通过系统性的实验，我们识别并分析了影响LVLMs解决谜题性能的关键因素，包括线索数量、网格大小和规则复杂性。此外，我们探索了两种在训练后可以使用的监督微调（SFT）策略：基于解决方案的微调（S-SFT）和基于合成推理过程的微调（R-SFT）。尽管这两种方法都在训练过的谜题上显著提升了性能，但它们在未见过的谜题上的泛化能力有限。我们将发布VGRP-Bench，以促进对LVLMs在解决复杂、现实世界问题方面进行进一步研究。项目页面：https://yufan-ren.com/subpage/VGRP-Bench/。,任宇帆,2025/3/29,2025/4/2,,,['cs.CV']
2503.22738v1,盾牌代理：通过可验证安全策略推理进行防护代理,http://arxiv.org/abs/2503.22738v1,由基础模型驱动的自主代理在各类现实应用中得到了广泛应用。然而，它们对恶意指令和攻击依然高度脆弱，这可能导致严重后果，如隐私泄露和财务损失。更重要的是，由于代理的复杂性和动态性，现有的LLM安全措施并不适用。为了应对这些挑战，我们提出了ShieldAgent，这是第一个通过逻辑推理强制执行其他受保护代理动作轨迹显式安全政策合规的防护代理。具体来说，ShieldAgent首先通过从政策文件中提取可验证规则并将它们构建成一系列基于动作的概率规则电路来构建一个安全政策模型。针对受保护代理的动作轨迹，ShieldAgent检索相关规则电路并生成一个防护计划，利用其综合的工具库和可执行代码进行形式验证。此外，鉴于缺乏针对代理的防护基准，我们引入了ShieldAgent-Bench，这是一个包含3K条与安全相关的代理指令和动作轨迹对的数据库，通过在6个网络环境和7个风险类别中进行的SOTA攻击收集而来。实验表明，ShieldAgent在ShieldAgent-Bench和三个现有基准测试中都达到了SOTA水平，平均性能比先前方法提高了11.3%，召回率高达90.1%。此外，ShieldAgent将API查询减少了64.7%，推理时间减少了58.2%，展示了其在保护代理方面的高精度和效率。,赵润 陈,2025/3/26,2025/3/26,,,"['cs.LG', 'cs.CR']"
2503.18213v1,《神经符号人工智能研究：医疗保健视角》,http://arxiv.org/abs/2503.18213v1,在过去的几十年里，人工智能（AI）科学家一直在进行研究，旨在通过机器完成认知任务来达到人类水平的表现。在机器学习领域，最终的目标是通过机器实现通用人工智能（AGI）。这一追求导致了两种截然不同的AI范式的探索。符号AI，也称为经典或GOFAI（老式的AI），以及连接主义（亚符号）AI，后者以神经网络为代表，是两种互斥的范式。符号AI在推理、可解释性和知识表示方面表现出色，但在处理包含噪声的复杂现实世界数据方面面临挑战。相反，深度学习（黑盒系统）在神经网络研究中的突破值得注意，但它们缺乏推理和可解释性。神经符号AI（NeSy），作为AI研究的一个新兴领域，试图通过将逻辑推理集成到神经网络中来弥合这一差距，使它们能够用符号表示来学习和推理。虽然这是一条漫长的道路，但这种策略已经在实现系统常识推理方面取得了重大进展。本文对来自主要科学数据库（DBLP、ACL、IEEEExplore、Scopus、PubMed、ICML、ICLR）的977多项研究进行了广泛回顾，全面考察了神经符号AI的多方面能力，特别是其医疗保健应用，尤其是在药物发现和蛋白质工程研究中的应用。这项调查涉及了重要的主题，包括推理、可解释性、集成策略、41个与医疗保健相关的用例、基准测试、数据集、来自医疗保健和更广泛视角的当前方法局限性，以及为未来实验提出的创新方法。,德尔洛·霍萨因,2025/3/23,2025/3/23,,,['cs.AI']
2503.18050v1,(I-DLE：通过KL散度最小化保持分布的Logit排除来进行生成推理的约束解码),http://arxiv.org/abs/2503.18050v1,我们提出了（G）I-DLE，一种新的受限解码方法，该方法利用KL散度最小化来保持自回归语言模型的内生条件概率分布，同时排除不希望出现的标记。与那些天真地将禁用标记的logits设置为$-\infty$的常规方法不同，这可能会扭曲原始logits到后验概率的转换并增加输出方差，(G）I-DLE重新规范化允许的标记概率，以最小化这种扭曲。我们在K2-Eval数据集上验证了我们的方法，该数据集是专门为评估韩国语言的流畅性、逻辑推理和文化恰当性而设计的。在Qwen2.5模型（从1.5B到14B）上的实验结果表明，G-IDLE不仅能提升平均评估分数，还能显著降低输出质量的方差。,李韩 Wool,2025/3/23,2025/3/23,,,"['cs.CE', 'cs.CL']"
2503.17860v1,增强检索系统通过推理时逻辑推理,http://arxiv.org/abs/2503.17860v1,传统的检索方法依赖于将用户查询转换为向量表示，并在嵌入空间内根据余弦相似度检索文档。虽然这种方法高效且可扩展，但往往无法处理涉及否定、合取和析取等逻辑结构的复杂查询。在这篇论文中，我们提出了一种新颖的推理时间逻辑推理框架，该框架明确地将逻辑推理融入检索过程。我们的方法从自然语言查询中提取逻辑推理结构，然后将单个余弦相似度得分进行组合，以制定最终的文档得分。这种方法使得检索过程能够处理复杂的逻辑推理，同时不会牺牲计算效率。我们在合成数据和现实世界基准测试中的结果表明，所提出的方法在不同模型和数据集上始终优于传统检索方法，显著提高了复杂查询的检索性能。,菲力克斯·法尔廷斯,2025/3/22,2025/3/22,,,['cs.CL']
2503.18968v3,MedAgent-Pro：通过推理代理工作流程迈向基于证据的多模态医学诊断,http://arxiv.org/abs/2503.18968v3,在现代医学中，临床诊断主要依赖于对文本和视觉数据的综合分析，并借助医学专业知识确保系统性和严谨的逻辑推理。近年来，大型视觉-语言模型（VLMs）和基于代理的方法在医疗诊断方面展现出巨大潜力，这得益于它们有效整合多模态患者数据的能力。然而，这些方法往往直接提供答案，并基于经验驱动的结论，而没有进行定量分析，这降低了它们的可靠性和临床实用性。我们提出了MedAgent-Pro，这是一种新的基于代理的推理范式，它遵循现代医学的诊断原则，将过程分解为逐步的、基于证据的推理的各个组成部分。我们的MedAgent-Pro工作流程呈现了一个层次化的诊断结构，以反映这一原则，包括疾病级别的标准化计划生成和患者级别的个性化逐步推理。为了支持疾病级别的规划，我们设计了一个基于RAG（检索即生成）的代理来检索医学指南，以确保与临床标准的一致性。对于患者级别的推理，我们提出整合专业工具，如视觉模型，以实现定量评估。同时，我们提出验证每个步骤的可靠性，以实现基于证据的诊断，强制执行严谨的逻辑推理和有充分依据的结论。在广泛的人体解剖区域、成像方式和疾病上的大量实验证明了MedAgent-Pro相对于主流VLMs、基于代理的系统以及最先进的专家模型的优越性。消融研究和临床专家的人类评估进一步验证了其鲁棒性和临床相关性。代码可在https://github.com/jinlab-imvr/MedAgent-Pro上找到。,王紫月,2025/3/21,2025/7/2,,,['cs.AI']
